{"schema":"b10x-docs-bundle/v1","repository":{"id":"devcenter","url":"https://github.com/beyond10x/devcenter"},"commit":"6365f2a01455ef450bb0c82ee61ba31d81658353","producer":{"runId":37858676483},"manifestSha256":"91c0c6022fba08a80505adf416af2bc2c7e4dcc8052b357b10bed3677cd4da07","collectionSha256":"76ffcc798c4620f415485d340dbfd1e22f1d23e205d51d7e86db8282673a3871","contentSha256":"7b9364191c966b7cfa2b1d814d7d7a3a65d63e283362c4e58b992fa82aa89f9b","files":[{"path":"README.md","sha256":"d6c80a937ad5857b164481bce137bde9b452b9b53b8c3e19296edd8b9aadaa35","size":17251},{"path":"changes/identity-routes-0.6.1.yaml","sha256":"d1dfa79126e1d5d959c14c0d4a6f3f69fb7f634ead6f7405706bc6353fb3b8d9","size":632},{"path":"docs/ess-deployment-model.md","sha256":"82648dc6f5358747411cecbdea8e51075e8c4465d0ed7b5900041ebf987143c7","size":10725},{"path":"docs/frontend-review.md","sha256":"0ac48a85bf69c75df7250372ff0ba4d9e3cb4250dab7198682d46bec1bed1997","size":1221},{"path":"docs/local-acceptance.md","sha256":"3edcd4ce408f5e93c860699bb3d12965b8e80e62d9ae57382fdb7c35f31c69d4","size":14033},{"path":"docs/production-deployment.md","sha256":"d3b447bc3ab758e890c3a00e5f7e37b3de0e907d53527884791bd139ec37315e","size":754},{"path":"docs/source-build.md","sha256":"81fc086d4ea7177c3e7bc8028b93040cf65290b708390e8bb8d51f4950c8ce08","size":806},{"path":"openapi.json","sha256":"2b994c23e453bd266f7cab2b5ece9943381cab1350746b8ab7d08f4e1960b1d0","size":125915}]}
