{"schema":"b10x-docs-bundle/v1","repository":{"id":"identity","url":"https://github.com/beyond10x/identity"},"commit":"f11a87119e026adce397dddf24c996653b9ec5b0","producer":{"runId":39533320999},"manifestSha256":"550cd6aa924793c806b5f4287b47ba14d2b473a0159b240859b1128786fe37b7","collectionSha256":"4ce6c0f44e9eebc17cf518f1b8b677302451c0b41f52264dd75a4aba94f47016","contentSha256":"43bfaccb68f0749b66beb74fcbadbe5a2af1d115b57f618f19b97fac7a772c9c","files":[{"path":"README.md","sha256":"68dedda7ea6554e5d0e85df751e4e1bbd7ed577fbe285feb21cf78b1242ad777","size":17195},{"path":"changes/public-surface-2026-09-01.yaml","sha256":"b9af99b7566cb5fbe1d6312513935ad8e7b91db7520bfb131c468d1e8c6bcc44","size":512}]}
