{"schema":"b10x-docs-bundle/v1","repository":{"id":"mandate","url":"https://github.com/beyond10x/mandate"},"commit":"581406688199357ad5c02a6c1c333f231a2726c3","producer":{"runId":38812429312},"manifestSha256":"330757f0273feebc0b96f9752743fbb82922aa9a02a638fd0d80d681a930776e","collectionSha256":"7675ac24fb8153a287422410b12881171f7350c7ae951466c87b643965451d7f","contentSha256":"1ba13b6d12203748d658ba1ae2475a2d59012a29af185fb2d82a832e087e1186","files":[{"path":"README.md","sha256":"78d042922263f7fac7c79469f588b9d3a187111db452de372fb89d849ff7520a","size":2696},{"path":"docs/public/architecture.md","sha256":"cd64b509af24a4692cc23986b7139f43e104eca75ecc9a2189705e5db3a47a3b","size":4121},{"path":"docs/public/contracts.md","sha256":"56664675ca93c60a266422bb314b7d24e143d76e7b9359f4b4797d3a255947fb","size":3003},{"path":"docs/public/development.md","sha256":"8863783597eb19f41c4cb4597112c7d5111979ab358181f42a590610ef4d7004","size":2380},{"path":"docs/public/federated-login.md","sha256":"ae10fc816ac49cd731ea815de922d98dfff0dc5c4c9703fc1d2fbe9eb5393948","size":19018},{"path":"docs/public/roadmap.md","sha256":"ad05df3852ae2c4a4586d33baa7781ba9abc0eb064067852a7e3481dec20513a","size":6693},{"path":"generated/docs-ir/document.json","sha256":"daa676deca5fd2839d93da5bf7fc765904e9acdca6d5a5852e5c85bab70f3e85","size":2009521},{"path":"generated/docs/crossings.md","sha256":"d751d797efe0aa4ac82fc051d88017dcec8b301e35ac3e32bd2d2936ee7f0016","size":1204},{"path":"generated/docs/domains/mandate-audit.md","sha256":"f13ab9ffe531bd322d45dc57305b8d15b55559df5bcc0894bc6f94ae64b3b9e6","size":11093},{"path":"generated/docs/domains/mandate-authorization.md","sha256":"c92ebceddb623acba7d214c1ed9f0ce9c7833e9de3f5afdc2aeb2d36bb96dce3","size":5129},{"path":"generated/docs/domains/mandate-core.md","sha256":"fb78e9966cb634e764cfbfeaeda0f8210a3b9cc802de7074e8633bfbc81b1c53","size":17516},{"path":"generated/docs/domains/mandate-credential.md","sha256":"e6ca9c8270d3e2fe18167bb6cb261a7d3c5ca8ea7a57ffe221f77529f81e8469","size":42146},{"path":"generated/docs/domains/mandate-delegation.md","sha256":"efe087aa868fa965609489ced684d74de7b24854a94c4b17abbf9ffc693613d4","size":28404},{"path":"generated/docs/domains/mandate-directory.md","sha256":"98e32633ecd1ccb9bcdf97d1233893d8f640bda205755942b4d7a4cb55c09f21","size":33484},{"path":"generated/docs/domains/mandate-federation.md","sha256":"8324f61542da8e2c5985cea20a03ef14b705320b54958d58a1e885dce8ef5789","size":30871},{"path":"generated/docs/domains/mandate-graph.md","sha256":"051a096ba81b8edde28ca771de05024961ec42a14ea392819314a7299bc2572b","size":17984},{"path":"generated/docs/domains/mandate-identity.md","sha256":"92bd8fbd4c849e5a0c9611366668f501728677e172ecd912a1ec982dca2cb825","size":25590},{"path":"generated/docs/domains/mandate-policy.md","sha256":"afd4cfbaf6765d98e7fc668d96b8f9e093e9a79dda5274e3523b7d36af69fb0c","size":10213},{"path":"generated/docs/domains/mandate-tenancy.md","sha256":"3eadc14ac2905c6efbfcce29ecb24e3dd10df2e94695cb93c389524481a4037f","size":33591},{"path":"generated/docs/domains/mandate-workload.md","sha256":"0561418517baf0b2176357f276a844963a24937f960e670e56be534a3d49e1e6","size":8434},{"path":"generated/docs/index.md","sha256":"9f905da647fc53f888754717466fdd2a5459952ecdbb3fef12e378c04f9ebe1d","size":23735},{"path":"generated/docs/interactions.md","sha256":"c3e4ecf76e8717e1a594a14723a51ec08a2da8a037fc20be8739f545670a9cd9","size":4456},{"path":"generated/docs/topology.md","sha256":"152b92c81c3d09f43366fb0a564ee4b86d2fbf38cd4c504ef9637dba792b4bd6","size":1143},{"path":"generated/openapi/mandate-authorization.yaml","sha256":"e873043a538d07b5ef31c7a9d5783060a6e0e1b62a1c402cbd7935db2fcd3fae","size":82463},{"path":"generated/openapi/mandate-control-plane.yaml","sha256":"182b7652923ce220e58aa8556aa4b715b2c15eef2b880d9b263c4cc43d63106c","size":343926},{"path":"generated/openapi/mandate-sts.yaml","sha256":"81dc36125a017fa02b0e656d99475c2568db49ee221e788e338d5cb75ddd7613","size":112312},{"path":"generated/openapi/mandate-worker.yaml","sha256":"c0c3ab7cec9e5158e4c23a75b873bc7bc22aaf4de39932c3654dd2f885b41724","size":31839}]}
