{"schema":"b10x-docs-bundle/v1","repository":{"id":"agent-platform","url":"https://github.com/beyond10x/agent-platform"},"commit":"2f38a467ec7f8c6b79d454f625f2997b48ea2739","producer":{"runId":37858037715},"manifestSha256":"40a65413e9f36eab96392529db1c09adf32ccbd4c460e1e1fc4dd0f22122071b","collectionSha256":"9911cad4b35b59372f6eb8db637e430e6843b1c4845c7993fa258b45c4d208ca","contentSha256":"63b9d64a60f81292a726ae2059c55a828b21aaf36e56d0ad8cc1aadafb211aae","files":[{"path":"README.md","sha256":"990e823066043ad864b4b25875eb85c5d0b908b7faf3a8266e32fea11e1a6b9f","size":6933},{"path":"changes/public-surface-2026-09-01.yaml","sha256":"319d962e8f7ed5997d2c10a53d3a5d3d3ab0bf0b741e4d89f6e2595d0490bb6f","size":678}]}
