{"schema":"b10x-docs-bundle/v1","repository":{"id":"entity-runtime","url":"https://github.com/beyond10x/entity-runtime"},"commit":"57b53d1edf8d9048df710b6c33de343fb570764e","producer":{"runId":36214832503},"manifestSha256":"f8268dc4b28dcad0749ad69357d458f30f5874bee7968c91858cc15668179cbd","collectionSha256":"260845d165efd29c08a8fa264b5b63e4fce88deffd17d842be787b8dfb157c3e","contentSha256":"f714f287a0408bf2c628aa6b1eb1547dc41f082acc3985d8f7c361745d1a9465","files":[{"path":"website/docs/agentic-systems.md","sha256":"b1c267f6971c96493905a1ba91dad0489f53c83e0ca0d91f530b60896132dcb7","size":4502},{"path":"website/docs/guarantees.md","sha256":"72a1a73c2c27e75b4ab4c1867b93869817f80f761afc9bea9d3286faab7730d0","size":4345},{"path":"website/docs/guide/agent-integration.md","sha256":"ca21165f1871bf8676b23b6f896797af2cf6b77dbca004fb7ce24bb3f2a73b2e","size":4646},{"path":"website/docs/guide/cli.md","sha256":"2464aa61388913e8b335c4a36c26d00f33abcfd83132669d3ed2352bad784136","size":6972},{"path":"website/docs/guide/definitions.md","sha256":"bbbea2320f01dd9e5c58dc409da08774d11b316a8f16d48c2e919063f7331e03","size":9900},{"path":"website/docs/guide/file-store-migration.md","sha256":"f7ec9026089991e397441182e3ad4e4812dc8a33aefdeaa0f0f0c1ae7b72826e","size":2594},{"path":"website/docs/guide/generated-cli.md","sha256":"3ebbe342b7873b7cfa06b2b9f05c468dae7b944a6ad52e263369e7b6f17e6d2c","size":5009},{"path":"website/docs/guide/generated-docs.md","sha256":"6e5d661e72f1fd71005432f0f39b23de1dd10b970f7489927e6b72780a344542","size":2568},{"path":"website/docs/guide/getting-started.md","sha256":"87e5f39cc9eb629f2e0eaeb7434c17c8214425cf56f375c629f5cd993d7ad410","size":6181},{"path":"website/docs/guide/graphs.md","sha256":"f40ea6053ac055b9ce26fa383ab434f0119e483682f33caf4e186ea8872f32f5","size":2099},{"path":"website/docs/guide/library.md","sha256":"e374e8a13109185692cf258866e8710e292cf76d4b5846e40fd14a0157889cfb","size":5287},{"path":"website/docs/guide/mcp.md","sha256":"ff3a4e283e47c47e367ea78b12748e339ca6679dda4e2693a70e12196f539f5f","size":2642},{"path":"website/docs/guide/modeling.md","sha256":"f488e89b0139f301f82267996d3ad41e8e058ab645afad2c61b120a4bd952ea9","size":3448},{"path":"website/docs/guide/refusals.md","sha256":"960ed4ee7d5a84a0556130d7e9f576befdfd12769ed77a34cadf94abe8b76276","size":4068},{"path":"website/docs/guide/storage.md","sha256":"39bc3248a4628547d49f805b168c05dfc8a87d01cd0f6323793c3f2f1ff177b5","size":10103},{"path":"website/docs/intro.md","sha256":"4f6f637fc0c735d476b08b7be8609e5ecae434149fd53648b349df0ba08baf46","size":3945},{"path":"website/docs/system-model.md","sha256":"25e5cbb60e9966e06b4cb8e9122096ec44960aa7b8b56036a3c22b6d92602de6","size":10013},{"path":"website/static/.nojekyll","sha256":"e3b0c44298fc1c149afbf4c8996fb92427ae41e4649b934ca495991b7852b855","size":0},{"path":"website/static/img/agent-boundary.svg","sha256":"bd3bc0329ce3e3f9b3b000fd1a0899c9c38db27bcc98568b72898f7af3cfd2b6","size":6990},{"path":"website/static/img/decision-equation.svg","sha256":"540c416cb7b807287e251cf43f96f8b88edd448bf88377647575cda6037709b0","size":3773},{"path":"website/static/img/favicon.svg","sha256":"358d95fd60818e0b57b1244e686d816833416900efc0fb2591d596907109b937","size":517},{"path":"website/static/img/mark.svg","sha256":"358d95fd60818e0b57b1244e686d816833416900efc0fb2591d596907109b937","size":517},{"path":"website/static/img/social-card.svg","sha256":"b02c979bb35f5bf38ecd2b8e494387b4966613e4f1fde2910fed2df4d0d3794e","size":1581},{"path":"website/static/img/trusted-shell-flow.svg","sha256":"d594ac07e23595384136dccda6adf8faeeee8aced828e4257bae87e5aa3c85ab","size":5886}]}
