{"schema":"b10x-docs-bundle/v1","repository":{"id":"research","url":"https://github.com/beyond10x/research"},"commit":"a5375907958eed7de3fb1fa5625f6e24e2722fb7","producer":{"runId":35199574746},"manifestSha256":"498b589bd44618f6d8fc1ff00b1cd2bcc4b05a39d52a448bc27192f61c9f34e1","collectionSha256":"28f6d57ae7f094723ae3150005e8338a8675ac390ea1e405c9f1207bf4ebf6d2","contentSha256":"24ce91d3580116161a8f75473e45a50350d48eacfa71b4240092feb04d44c4f4","files":[{"path":"README.md","sha256":"b23828c5452a4a3f8fd0cee1fac8a40475e43c813563d249cd6c460e69a42808","size":3858},{"path":"changes/public-surface-2026-09-01.yaml","sha256":"7aac089e2d23013c4b065ebe3802059b79f922dc0c7164c9b3eab4a7c0098bae","size":647}]}
