{"schema":"b10x-docs-bundle/v1","repository":{"id":"gates","url":"https://github.com/beyond10x/gates"},"commit":"ea594906d780c3c70d1d54a9f3436e46f5a28ea3","producer":{"runId":36519086159},"manifestSha256":"a612f4bee6f00ab8ee11eaadf4ce729166679f7a558499bf5274951edc882243","collectionSha256":"b8ea7774601f7a2b6002871472bc06983673eb94851ed27e21e98a79a99d7cc5","contentSha256":"a162091a8979b533b3480e557cb521b8af1b8f947d44e9ca8ae6848c3f3e55cb","files":[{"path":"README.md","sha256":"5b963c4429c3b7f98e7f8bf840ab136ad48c8bee95757ced759967058cac0a1b","size":14649}]}
