{"schema":"b10x-docs-bundle/v1","repository":{"id":"mcp","url":"https://github.com/beyond10x/mcp"},"commit":"919ca761af1ca7f9286ebfd899b7556ddc4cb74b","producer":{"runId":39717730091},"manifestSha256":"35a129a55e56735f51f2464c2fa1f24b1711633dbf8e5f821976aef069efcbf2","collectionSha256":"d389f7d47f1ae1da54b22029618c70c76789a901f664a7a9fdbe304137a7bcbf","contentSha256":"446613c0a33ef64d36bb22c15f6df325b2c56fc6b7eaace32dfe93f18102bc44","files":[{"path":"README.md","sha256":"012f8008e5c914607875ead811d47e40ea4a2f21638bec73fccd023c31846c21","size":10199},{"path":"docs/design/0001-consumer-authority.md","sha256":"8b2830f50182bc11328388fa2618f79eb9db6a01523805672e017fa78ac9be75","size":2257}]}
