{"schema":"b10x-docs-bundle/v1","repository":{"id":"harness","url":"https://github.com/beyond10x/harness"},"commit":"f109612eb184f34ce6f7cf72f25b89a928320c39","producer":{"runId":39386168865},"manifestSha256":"a99c053b1780d84420d4d4f82fa80f80db60a27887ee1eefad1c3aa0d865eabc","collectionSha256":"a895581fcd8a53ef7ea4cd033fe53d525b5acbd0f01e2d9d607b9021cbb8a97c","contentSha256":"f3ff0356735630a5bf739e54a4b881d0225c96f63c837d5f4b95172ed49ecfa1","files":[{"path":"website/docs/concepts/agent-loop.md","sha256":"37b099cf13b08af70f6ccbbd2698314d2b4d5ca775652c6ecd1be23a5b8f09b8","size":4063},{"path":"website/docs/concepts/security-boundary.md","sha256":"019b00ea4bb06b9e597092fd6fbe17c26ed0dee3b9e00e4d0296df0a472b464a","size":7715},{"path":"website/docs/concepts/tools-and-approvals.md","sha256":"7c2850fef491541f82eace38d9cf1340b4fa4fa65d3d6b393eea27548b193891","size":4862},{"path":"website/docs/getting-started.md","sha256":"787e6c70dca92c1cb0011b12243c6457e9ddbc731abb742bebde58be58fd6b2f","size":4871},{"path":"website/docs/guides/confinement.md","sha256":"f848e2b8670133b2300d14b52de57bfa9e1424df9931a8c2bec71f642b5f19f9","size":5507},{"path":"website/docs/guides/profiles.md","sha256":"8e5be5a2f07634dcc197e07f476321f08ca25c2e5ece214c906f4211b6313155","size":2571},{"path":"website/docs/guides/sessions-and-events.md","sha256":"f3c9093dc7db2a5b25f36fc8040e276168b758680d1f88ffdced18f27ff08f7f","size":7510},{"path":"website/docs/guides/structured-runs.md","sha256":"662f13ff60d80cb06c0425067a9feceedefc976b4d41721be98648a3db91441a","size":10290},{"path":"website/docs/guides/workflows.md","sha256":"6537faa40fe06d473b69834a3cce94f3c6e6aa8e0833d05f5dafb23952336530","size":2531},{"path":"website/docs/index.md","sha256":"2bee576f0a43603c07826307572705e48bfcf579d790e8ffc15db9bcaa0965ac","size":4069},{"path":"website/docs/reference/cli.md","sha256":"d269776012dd6a52c5b0698aca818f9980859d4a836f95fac9b3b363327628e4","size":15097},{"path":"website/docs/reference/configuration.md","sha256":"aaeb5ee190e9ce2dd1adcfcc6949c5ddd5e15152f2924d0f3ed05800981d6ae9","size":11889},{"path":"website/docs/reference/toolchains.md","sha256":"0832821c65f82187700d79d57dd1f030b537ba180775885a64cd7483522478a0","size":5963},{"path":"website/docs/reference/wires.md","sha256":"4f47b742a0a8e9afa2bd9f65f3911befafe7ebbba769405647d0e2d0daf8560f","size":3912},{"path":"website/docs/reference/workflows.md","sha256":"35a701a051ee12252106128257e0d209df96441d8a50bc83df17467e15e6e7ff","size":19820},{"path":"website/docs/status.md","sha256":"0f33f0e4f97edca8482c039c8295fe59e62d61441f9eb3a5140d812b11c6c92b","size":6565},{"path":"website/docs/tutorials/confined-change.md","sha256":"50b4a447ae7c58e7661ea0458c62fde4fb80b874260323b1e620614439bdb4c1","size":2463},{"path":"website/static/img/favicon.svg","sha256":"e01fff8ada2dfb752866ed903c9a03245d519597d69b021f0d4a4ede7aed3992","size":744},{"path":"website/static/img/mark.svg","sha256":"0a38abf8dd3c2c28ef33be489a9e5f47d1d938d413ee2df2a02574e12f92773a","size":776},{"path":"website/static/img/social-card.svg","sha256":"7eda02b767cadc9bbd663e10a544d9658cac31d37265959f54543a41593b9584","size":1671}]}
