{"schema":"b10x-docs-bundle/v1","repository":{"id":"connectors","url":"https://github.com/beyond10x/connectors"},"commit":"55bfe18133a3b2e887e52092af595d5d6adf82aa","producer":{"runId":37766588413},"manifestSha256":"9ccc3c2c32816092d31e681676ec24cd33083f473ec597c9907ecc57cb7cc275","collectionSha256":"0456e88d29fc8e332675d6ac29219f5ca18859f2bd1f900c64684702ee89e1a4","contentSha256":"d4486c124dbfaf005afab76af6478b484558ad314596efb524c1926c2fb0f3ff","files":[{"path":"README.md","sha256":"5cebc78314804b691959f8e1cb8d7116ca5f555d7773e6e66199793699e0cb1d","size":11959},{"path":"docs/compositions/monitoring.md","sha256":"8d68122aaa90edc27bb3cedb1b46923cd8672450a24635acc2a80bd2bee65644","size":4221},{"path":"docs/design.md","sha256":"38054cccbffd3b4cf57abdb28f5f681a4d0fa78ae950c1cdef0860cf982927ab","size":147714},{"path":"docs/development.md","sha256":"a2f9b58bd5bdab78aa753efddd31e820cbfab2bd79d2d10573ddb286e94b9046","size":13899}]}
