{"schema":"b10x-docs-bundle/v1","repository":{"id":"extensions","url":"https://github.com/beyond10x/extensions"},"commit":"a544ba20a4a4e63895cbcdc2a5cf9cd9ee95e14c","producer":{"runId":35915338122},"manifestSha256":"5e993458554326c5d8a4ffa10ef8cdd369800bbb9e6a2f383a160bd208e1ca19","collectionSha256":"6e4a4bcdbf2d512afbe53a525c48e98b02422ef9412790d7074708ed13920458","contentSha256":"2d06ca1af93842d56b5cd154ee9625d507b014c60995b561a04aa4ab4cde1bc8","files":[{"path":"README.md","sha256":"1beff73d42f35a698bb110735544f71f86b7182e46581ce3caa86c8d76814c19","size":5354},{"path":"docs/model.md","sha256":"a7dcafc6fd1bd4efdd928ad27870ffea0254c2e88428fc737560378b475e31d9","size":48439},{"path":"docs/scenarios.md","sha256":"7d3cdb2f56f17c8e00bb808aed94c56c306a0224e3e6eb29735d1f1a0b880c64","size":18952}]}
