{"schema":"b10x-docs-bundle/v1","repository":{"id":"agentplugins","url":"https://github.com/beyond10x/agentplugins"},"commit":"840959533b7776baa2eefee10066f6b9ada8a07b","producer":{"runId":38411852506},"manifestSha256":"ff2d9ac63b093d5882a1008ae48d9f966cbb80c8c89c7d44e011ff20361872c1","collectionSha256":"6d5f662ac4d26b85534a34a511dd1e68137d394a6026704aa66a8928689b0aa0","contentSha256":"87d847c66bff3666fad01b956dee1be35671b110c2bbb973a4861f162d0f5e44","files":[{"path":"changes/aep-refs-0.3.7.yaml","sha256":"8efb6de95003584d209e2f0acbf815f375d344b2fe7c2e593a24c6174a488970","size":750},{"path":"changes/second-adopter-0.4.0.yaml","sha256":"84c1cf2fa7043f9e204160dbe1f42d887e8b3277c8dc0bd12631f9c2e024f057","size":776},{"path":"changes/workspace-hygiene-0.3.0.yaml","sha256":"5b0dc75ecb64954a5622cc60256399fa3776e986fc61c4dad80a7f463796c2c5","size":694},{"path":"changes/workspace-hygiene-0.3.2.yaml","sha256":"ad5c702a1878eb1a0148324541ce6b5572f18fec26d0927117f7b88c3e86efa5","size":745},{"path":"changes/workspace-hygiene-0.3.3.yaml","sha256":"a4ae76c3aea4a15f536085091d75d9884398764ce8bd83222a9ed189512098fe","size":801},{"path":"website/docs/choose-a-plugin.md","sha256":"babeeaf53cc0f16c3a1358a2ac15bb9c8abd0b3834d1c5af0665e909e99edb43","size":2656},{"path":"website/docs/golden-path.md","sha256":"ae4ee0958c676b078c0c45c92fd8850b5b05eb5eba89e4a88a3b1284e17227ea","size":24663},{"path":"website/docs/install.md","sha256":"1ebdd3bc9bbb2a37ad00666495aefabac3b48e435b9eab82dfa12e7adb72a18e","size":6273},{"path":"website/docs/intro.md","sha256":"0b305e1cef465acf8b253e9b886bfd1d82b345cf2731b09346d8b1255a7c07ed","size":2175},{"path":"website/docs/plugins/aep.md","sha256":"ec619be07a4ff0668f502f4fb93cc22c31b67e53358a13252945aa98b55aaad8","size":6478},{"path":"website/docs/plugins/b10x.md","sha256":"055b9bef91104d609358360dea9c95a94882132839a003ecf1daa8a77610ef14","size":5922},{"path":"website/docs/plugins/connectors.md","sha256":"f9249a809f18de710d93f700f293d5d9261813f17fa32c6c136e23027733862e","size":6573},{"path":"website/docs/plugins/ess.md","sha256":"8b80f160c794b63873172bd1865f5bc0398d5a56b584fa60328f492a2c4a48e2","size":1567},{"path":"website/docs/plugins/worktree.md","sha256":"90473b42d5e73f41291cdf47fba29d065520a626caf2ae606050b0a9409584fa","size":7268},{"path":"website/docs/structure.md","sha256":"129e9d506a4dc8f05f6ed4ff72c5b73413d8473a231b535f780469a9a2fda0c9","size":3996},{"path":"website/docs/trust-and-scope.md","sha256":"1a52214dec9e23aba7759bebb6ae283808956f68bd2c16ded30731126dc282d1","size":1282},{"path":"website/docs/tutorials/first-ess-specification-2026-09-28.md","sha256":"2bd43a7f2dc38c6a7961658f2fd0d8f160b94750f7491d9741d73f049e0019ab","size":42231},{"path":"website/docs/tutorials/first-ess-specification.md","sha256":"a1e850baa4b24a1bf1082e9987d7b090192c00966af66811d194a14476ba838e","size":10689},{"path":"website/docs/tutorials/first-governed-plan-2026-09-28.md","sha256":"351da83e2c069e9deb2220540b60f553771a05e873334465e26c437ff04d726f","size":21722},{"path":"website/docs/tutorials/first-governed-plan.md","sha256":"94261f73d7f8b14decc777b18ce97c145db86b928de0dd6e331c49b6793b2927","size":9190},{"path":"website/static/.nojekyll","sha256":"e3b0c44298fc1c149afbf4c8996fb92427ae41e4649b934ca495991b7852b855","size":0},{"path":"website/static/img/mark.svg","sha256":"b183e0fa09f3a7235bbcca4e76672ae6b97b237c4380c037edde46b83dfed717","size":393},{"path":"website/static/img/social-card.svg","sha256":"ae2e94d3b1535d2396495f02905e1e53d4cc42ec01a67740e79e4b236ff312c1","size":836}]}
