{"schema":"b10x-docs-bundle/v1","repository":{"id":"worktree","url":"https://github.com/beyond10x/worktree"},"commit":"8143444a97625ba031b699479150601b1be3a46a","producer":{"runId":38048551548},"manifestSha256":"e02421be2b04c03e88207988a3ce0371812c092194053a2d588367daeebcf36f","collectionSha256":"89a155f9220bb7ffada4e7d3d51d08297862cd837f438f429b7a25f3c04dea9c","contentSha256":"ec05e4ae335941ae423a589c196c0fda600616db23ecb372210e25dd54366095","files":[{"path":"README.md","sha256":"9f4f974433cd9f80ddd8a9109a4670a0b2bcbf554ab48b27d5454968b25ed1dd","size":26442},{"path":"changes/worktree-0.1.0.yaml","sha256":"bfe1963de631ed000461b46733c7c36a171fc2e97ad7a30e395ac6207a9bd8de","size":649},{"path":"changes/worktree-0.3.1.yaml","sha256":"e40dc541478a8f2708caf3ccffec76ece5241ee3599b50485b7c2b4e4a07ad79","size":742},{"path":"docs/architecture.md","sha256":"4c66a7845758ec509bfba9e382308fbdd9b50e68747a31b2e07f1a40d44dda55","size":19675}]}
