{"schema":"b10x-docs-bundle/v1","repository":{"id":"metaharness","url":"https://github.com/beyond10x/metaharness"},"commit":"b1e7f56b9cfe33fbcfa91b00af63d42df3298db8","producer":{"runId":35916535508},"manifestSha256":"4b5d466f6a1c90d951f3e25a04b35cc845b17c2ab69c64e45ff3dd49b30e573b","collectionSha256":"edf5d0b076ec6e301ea6274ec8d6d4ae557326dd506b12bbd19774095b971e63","contentSha256":"fab4b19861655c0ddb6d48f62ee77f136980b908749ce21b46b76434cdee7641","files":[{"path":"website/docs/control-seam.mdx","sha256":"20a8f7a7f81e93b270000b9134c81c876200fc9df33b4144e0b98bb92d953678","size":5959},{"path":"website/docs/frames.mdx","sha256":"0441839867348b053bc2b995ed13de1b714c6fc2622f8530eb274653af231f5e","size":4483},{"path":"website/docs/harnesses/b10x.mdx","sha256":"ce5d5d0bbfb7100be2b023694213c181d2f7ef1140fbe388296d1ecbf886a60f","size":7916},{"path":"website/docs/harnesses/claude.mdx","sha256":"a8b38af24a5561ca1770981ad1cda3fc498821b92d222c7f21e1b1b9b4e62955","size":3505},{"path":"website/docs/harnesses/codex.mdx","sha256":"c956ef6ed648ac88a27dc185afe7217b9a73c245bb261334c2c83d669b349067","size":9987},{"path":"website/docs/hermetic.mdx","sha256":"4b97f973560630007940aa88466a15e1e42f0dd92fc45bb4739d34e47859bfd7","size":4710},{"path":"website/docs/index.mdx","sha256":"0e72f8a419ef2a4bc579ee36c18cbc086b9bd2140ff3dc49150c516cc4e5abe0","size":3379},{"path":"website/docs/protocol/commands.mdx","sha256":"b85b09db0cb9cbca76e49c068363b13b4a5b94f72afe80fcf53480a702fae111","size":4457},{"path":"website/docs/protocol/events.mdx","sha256":"9d0e1ab7e619c1e5ea3bf27827ad208ccd347ba307c55cb3313f8a4348a616ae","size":5803},{"path":"website/docs/quickstart.mdx","sha256":"60b3e7c0de9bca776ff25e4d5c87dcfb26c4c811a25911f75ef17dc0a9792abf","size":5225},{"path":"website/docs/reference/cli.mdx","sha256":"8eaf4c7337b40da4bd0dc512f1ff2c27efafb0a15f80011e0d399de4a37f7569","size":9578},{"path":"website/docs/reference/library.mdx","sha256":"f6372ce5cfdcba5a4d4f6b0faa2c4c56dc6bfbf1b42234d50490887286e59028","size":4662},{"path":"website/docs/status.mdx","sha256":"ee5eb285b05980ffdf962169b9abcc764737c824a7a6915153818a2f914ad0ff","size":11538},{"path":"website/static/.nojekyll","sha256":"e3b0c44298fc1c149afbf4c8996fb92427ae41e4649b934ca495991b7852b855","size":0},{"path":"website/static/img/docusaurus-social-card.jpg","sha256":"7e3f3833e6742ffcc323c56380b3d1faf185c175534ea5591686bf879a1f7cfb","size":55746},{"path":"website/static/img/favicon.ico","sha256":"7fe55819f14792d942d86092f519b6d425e995337b482a8743e363cf5ac0ae30","size":3626},{"path":"website/static/img/logo.svg","sha256":"c2ae4b0e5603791e869ed5bc34a60a709d1ec6343fc22f75d97937aaafafd7f7","size":6438}]}
