{"schema":"b10x-docs-bundle/v1","repository":{"id":"eventlog","url":"https://github.com/beyond10x/eventlog"},"commit":"b10ed05a16b43d35cef82c3549dadf1c385e9318","producer":{"runId":41185274111},"manifestSha256":"2f00f61b1ed331b5a36a196ba88a21d3e49355ccc7a2bd59b8e7a73d9207927d","collectionSha256":"404eb3d30aeeb11320ea9161f9b3ec312dd3c0053ef55b2779de5ad3fb7d97e0","contentSha256":"6e1e860cc3d0ede8ee00b0dba768a71b960e7fc477788dc28696bcab3fb9479b","files":[{"path":"README.md","sha256":"fad1c529e5e6d32da7b067d7b295dcb3ee8a158c73945a4367c633d3263e7c01","size":3864},{"path":"changes/public-surface-2026-09-01.yaml","sha256":"357270aacf6a62a1b345fd4dfd4b8b6f17114f203e6485584bde09686f521526","size":601}]}
