{"schema":"b10x-docs-bundle/v1","repository":{"id":"substrate","url":"https://github.com/beyond10x/substrate"},"commit":"9c95ad76266725cb1380bd302d80962a6fc6e5df","producer":{"runId":35916495049},"manifestSha256":"d5817ee13dd2ab37d94d6b197285fbe178c83e84b6ee495c92423abda0bae589","collectionSha256":"51cfead3e792fb7988cd5ea89effc540a5336ff036a56ce444d0923bc50b326d","contentSha256":"62c684ed0ab3bb09493b04711c92790b29ddd06bf6c3d68d722196a5506438a0","files":[{"path":"website/docs/concepts/boundary.md","sha256":"00691e4f17108826c0d50bd7bc7af384bdc67217b447526199db54d67268fcc9","size":2571},{"path":"website/docs/concepts/confinement.md","sha256":"1d1da4fde253d5bb166deabe395ed66b61191823b6a8883c3e080fbb27680d3a","size":3149},{"path":"website/docs/concepts/model.md","sha256":"7274b778d79a9d8cadb5231c67ba402801cd19c33ea2c280f6ce178464c2f95a","size":6792},{"path":"website/docs/concepts/operations.md","sha256":"eb97b48b043dad0f47272d5ada70b2dbb01684be04f5ec86b37561a97208f057","size":5454},{"path":"website/docs/getting-started.md","sha256":"b9a1a137a48e8d79cace500c2624c8b6a7abf577c6eb5a9331ecfa9b26ca2c0a","size":5198},{"path":"website/docs/guides/deployment.md","sha256":"bc38fb7f4499f175b187377a9c0e7468be5f338778d09234b1e104ddf3616d68","size":5912},{"path":"website/docs/guides/mcp-adapter.md","sha256":"68b115df5b26b20c9e5807c706b268c719ea48a41e48309e4b5f2076e7f61a94","size":5466},{"path":"website/docs/guides/run-a-command.md","sha256":"f03898cd2066c4bbab1d853000625aad8a163f1abd48fa433a43215e2a950704","size":8101},{"path":"website/docs/guides/rust-sdk.md","sha256":"789504effa5273aa56fb073a6cf5dcf6da2f102fe87155f70a0173642ac82907","size":10951},{"path":"website/docs/guides/storage-and-metrics.md","sha256":"9bec8f10f9ba14f4b57296210bc01499949e68f85977e52867dd0451cdc0c196","size":5466},{"path":"website/docs/index.md","sha256":"4e2e07e78258ad08b142e941c8bbbb9586f91b66a59e57ffa0724eb2023f4369","size":3506},{"path":"website/docs/reference/contract.md","sha256":"18268dfb1157e5a7f330c1078ba0ab949ee7951c43aba4722ec15ec8cb535ca4","size":6828},{"path":"website/docs/security.md","sha256":"ffc77b6e86ace7f310ae66a39c9be18e87016ea527e31c6b9d7adfbf8df1ea91","size":836},{"path":"website/docs/status.md","sha256":"46b572d225ff6153cccd3684e21e1eed052503427ec24b2459514f86a9a56664","size":4617},{"path":"website/docs/use-cases.md","sha256":"370ccbe1e5448b2e92a832b1b5fd4d48253ce16feb3669913a3eabe5338691bd","size":3765},{"path":"website/static/.nojekyll","sha256":"01ba4719c80b6fe911b091a7c05124b64eeece964e09c058ef8f9805daca546b","size":1},{"path":"website/static/img/favicon.svg","sha256":"f5d229640c4f4129ec6282e72000d403fbaa85d11ba2cff10a9b3610b68f655a","size":535},{"path":"website/static/img/mark.svg","sha256":"435ed7c3faf3492a3e12d7dbfff604a82d4815eeac7dd6c81e4a7f836c4d4f7a","size":608},{"path":"website/static/img/social-card.svg","sha256":"21160c26394b3667d47c58750ef6909883f01e0ee636a9588b64abd322f4c21f","size":1741}]}
