{"schema":"b10x-docs-bundle/v1","repository":{"id":"aep-service","url":"https://github.com/beyond10x/aep-service"},"commit":"9bc6f64b12b58f2f84472001aee068c45fa59d12","producer":{"runId":35193057780},"manifestSha256":"7aff04b81e20cd920a664abbfd80a7fa919d20d567adc5d540171c6583da7e35","collectionSha256":"d6c809788aa434d65a5eb490ac9d40354bebc468051f029edac9df1e1a4fcd00","contentSha256":"5271b5a9272b8e8f6da355aca5f982e0fed96adbc6cab78ac71682f54efcadc6","files":[{"path":"website/docs/architecture.md","sha256":"fe46398d251a921ac53dc9e4cae09bc5066ddcd7daff9af107bc9c847613e7e6","size":4731},{"path":"website/docs/commands-and-queries.md","sha256":"6e91ab1d328b0df12a6ec91b73c1aa79e8c119ccf6f4bf765a8a2248a36fcc17","size":2716},{"path":"website/docs/concepts.md","sha256":"53843838eee24a060eda78d03b6e6dcc3083fb89e35d47f18f63a179543c92a1","size":3071},{"path":"website/docs/configuration.md","sha256":"40234b6816caf7d7db3374c4a0bcb2766a228b072016d19d78aa47e123815049","size":2754},{"path":"website/docs/http-contract.md","sha256":"7d0b09a07e958ec6175787ebbcdc6df4b5aed5c586576884f62340cae8dfccb3","size":1975},{"path":"website/docs/intro.md","sha256":"322090f032dc74631397d140f48e4dac1765072f11457ef21f912d6ab071eb34","size":2820},{"path":"website/docs/operations.md","sha256":"d3d63dde2d9f322ec5c87124d07d797c766eee81547b2fd9515ce0f7d5c6e17f","size":2455},{"path":"website/docs/quickstart.md","sha256":"6fc313032004a8b0f77606863c5bed2024bb2b591f3106f90b2161ce899047cf","size":4606},{"path":"website/docs/release-status.md","sha256":"55f22d7a580a8afffad2554c1d767cf3a569cca4ed66e3df0110a32e5f2c2fea","size":1867},{"path":"website/docs/reliability.md","sha256":"f97bbfab74ed0a1c1d83f88287abd8472aff68c395a1e08cfdce7ad4c51b5380","size":2464},{"path":"website/docs/security.md","sha256":"e52da0ebf4ab411ca6d9982bb9934eb0fe2f251baeba1fb0e5bcb1b70daae951","size":2463},{"path":"website/static/img/favicon.svg","sha256":"24670564011d0095e195449d7c3d6b0a396d185a08125f9f0fa4bf5a2e80ff6f","size":203},{"path":"website/static/img/mark.svg","sha256":"673de0579f1802aea31c94ff073ec3f59df7c07f81ca3ed188ddbed6a5158d3d","size":537},{"path":"website/static/img/social-card.svg","sha256":"f409edba95aada93a24fec7350abb544825114cd43d47ea8ebd10966bcce0153","size":1801},{"path":"website/static/openapi.json","sha256":"52c71854fe3129ac0dde7c847755bcdb473d7a282d82278c8373fc49e70ff2f4","size":192767}]}
