{"schema":"b10x-docs-bundle/v1","repository":{"id":"secrets","url":"https://github.com/beyond10x/secrets"},"commit":"0438297bfe9693e23c8f0c1c890cbf923265d1c0","producer":{"runId":36453424516},"manifestSha256":"7042af4aded4898c4ca30373e4a8f144e2e497cbbe5b61704b8aa5ca1caed98b","collectionSha256":"d7d3fae710bc27c6be9a98c58696ff2d7db4facb1453def5d928cf9657da3ac0","contentSha256":"195fa1b2d15da5c889ace5bc0cd92bdcb30e92570be8bc084e6b31a2c37fd053","files":[{"path":"README.md","sha256":"e75a65694898e5131c43b6ca2eda1f09df62f508e0d3f7a4b71ca129d27a5954","size":4073},{"path":"docs/architecture.md","sha256":"205a492c37d0b6dde91c8734c30ba41aee39fa8989dc1f11685c2b62c57748f4","size":2157},{"path":"docs/authentication.md","sha256":"ea726ba008359e9d5ad0511f24931c6dd208e47118593ba3f00a14d5e2edbaf6","size":3968},{"path":"docs/getting-started.md","sha256":"db89103b6204e6d28bb25595e814b5de288b6af5117e8312151c98f2df53fc42","size":3078},{"path":"docs/http-api.md","sha256":"d5a23820776721594764bdc55ec638150c3ec94e0186796edc340ebff0f3456e","size":7349},{"path":"docs/limitations.md","sha256":"aa2c9c6b480c4a41c4b44ed7aff7b035871117eaa4e39d66462ec979fea1cff3","size":2354},{"path":"docs/openapi.json","sha256":"2d40ac982304b3ac3c5e542fca50e07079e7798c0bc4a00d6a23f10d16a275f2","size":5936},{"path":"docs/operations.md","sha256":"fdfcf93c637427913f2e48649f1feb927724c088166fd13f44e6ae9e68b16a80","size":4301},{"path":"docs/roadmap.md","sha256":"2ab57c1e78e8312555c9e2628975d76e49756df1733bf7e13d7d06bc5c74e08a","size":3400},{"path":"docs/rust-client.md","sha256":"10e80f32468471d17e789cfce57dc5efb79af38c321033f92916a47643766157","size":3274},{"path":"docs/security-model.md","sha256":"429c88a729b00cf1dfdf8180945ed11a7ea9c62f01dd25a176ce01cea060c406","size":6098}]}
