{"schema":"b10x-docs-bundle/v1","repository":{"id":"agentic-principles","url":"https://github.com/beyond10x/agentic-principles"},"commit":"d5962af97e06f9e77539042ed2825a94a4723258","producer":{"runId":39721356979},"manifestSha256":"94174011060fcdb72645fe234944d4687b3761cb37547919d6ba3a4d4c2bc220","collectionSha256":"b49699fa38a770e2b391305a08435e44612ceff9ab264f71dfff19003bce9637","contentSha256":"00a6417d85cbeedacb0d3b0e88050144f40ca8fa51382b86e82ca4af767a5c3f","files":[{"path":"CHANGELOG.md","sha256":"0f207e49e10d8a248e138df8c41cafc8da8412a0f5ba58121a155caed9ea0ff7","size":4306},{"path":"README.md","sha256":"e06fb5ae0920c14c2ef7c8cdba5a4ff5c4870d88e7786874755570a366c7c9a6","size":4905},{"path":"blog/2026-08-25-what-the-operator-actually-contributes.md","sha256":"9f679621cc05af6c90a3b73ebaef8f7ccdf08bd8bfe8f9d27eb12d5ffaad5e58","size":10095},{"path":"docs/VISION.md","sha256":"1ff7380f2483ba35cd4a3c0aee734e0947b8c4dc46c5df20a8671dded42d67bc","size":8520},{"path":"docs/principles.json","sha256":"5f31ccd36eb18af093bd90fd88607fed80e858c3ef99db7a6b4efa6feed066a8","size":5034},{"path":"docs/research/2026-08-25T001928+0200_seed.md","sha256":"8d152a9f9fede7166c70f75329a9e039422fd474dd1609026cb205aec44ce1a8","size":9441},{"path":"docs/research/2026-08-25T004318+0200_engineering-protocols-workflow-fit.md","sha256":"a3ef974c67a3c1afd08d349bf984524041a92ae494118a0f7cbe8b2579ba82c8","size":12022},{"path":"docs/research/2026-08-25T005715+0200_fix-the-source-not-the-adopter.md","sha256":"6b0bd688ed382056d74cb25a2c53c7151e3bcd4f929c78a3f32c64e0c9de5e60","size":5551},{"path":"docs/research/2026-08-25T023000+0200_scoped-progress-under-partial-failure.md","sha256":"992418572b585a73cc04103763c3d52e42abc016ebd59d2210aca3ff4a862636","size":18165},{"path":"docs/research/evidence/scoped-progress-partial-failure/README.md","sha256":"7dda400fb74dcecb14c92de1922f24ac9511613ce52aaeed3558f7d907c96c02","size":2477},{"path":"docs/research/evidence/scoped-progress-partial-failure/analysis.md","sha256":"470541ecad82032c2cb65fa9de57ea68c8e9c2c1709ab397608710f8b1eaac0d","size":3892},{"path":"docs/research/evidence/scoped-progress-partial-failure/sources.md","sha256":"0b98e9ab2097f7378131bf7ad7bd7b9df2aa3a0aec1a08460fcb90f50cdc05fb","size":6978},{"path":"docs/transfer-packages/README.md","sha256":"bab23691e08a933c8121a04c167f2f3fd2272643c9a54ca169bb17b9d827274d","size":6829}]}
