{"schema":"b10x-docs-bundle/v1","repository":{"id":"service-sdk","url":"https://github.com/beyond10x/service-sdk"},"commit":"77ca69757ae888a9e868a3b1d00fbdd00f9b9bc6","producer":{"runId":37853246171},"manifestSha256":"36c43414330046fda05104c8886ff2e49377cdc3e669ca29c62a522486df9271","collectionSha256":"a6de53ebc6eb514e7d4f503b28896cecfda868a0fc13adb499d2d4853f730a8f","contentSha256":"5c78aa67f9b6f4a9ed2e1a898d2a26abcd9ed5e48ea8bc3a657b052fcd380d67","files":[{"path":"CHANGELOG.md","sha256":"44d0be244d01bc72f12d291252e8b6abc87c2f5ccf41f8453d077048ce895861","size":11411},{"path":"CONTRIBUTING.md","sha256":"dce8076f8318670bfd43a026c3f96b80426e841eb343e6ac68d637e7459bd470","size":1133},{"path":"README.md","sha256":"7eb01f7eaa51d22c7c78d99afe032cd85477066166613c9540b0fa195743b16d","size":15311},{"path":"SECURITY.md","sha256":"3afe600e5e7c528207aebde661aeba9b8823bf351b296ef300a9dc61d87152e8","size":1163}]}
