{"schema":"b10x-docs-bundle/v1","repository":{"id":"workspace","url":"https://github.com/beyond10x/workspace"},"commit":"7c8b23cf488175ea603167dff2986cbfdb9a712d","producer":{"runId":35199631072},"manifestSha256":"b4ae19b445adf90ea510d24d346069be4b771a9b1d9b171f80dac79894f34ab1","collectionSha256":"c65f6bcb634b7c4b52cbefa8eba45e53592980a92e42f92fc6b4d9fd70bb86a6","contentSha256":"bf404ba14f77864709ff0a57d901b1d45a963bd36610bb044e33c07b2eef0d75","files":[{"path":"README.md","sha256":"c929f4a13e9a4b7f7e6e47df1190b476e0423de41aa926dd41c56e5da3efef14","size":13621}]}
