{"schema":"b10x-docs-bundle/v1","repository":{"id":"workflow","url":"https://github.com/beyond10x/workflow"},"commit":"fa8fe6bf904f04d4e4c7b04deb5f2163950a21e8","producer":{"runId":39533045552},"manifestSha256":"f082f0abc7b260a215e183a2e4d0a0d277c11f901303de94f0c722f820357cec","collectionSha256":"2d6a0bc0ac9bad8a8562549a3660995dc518a819bbc3d87d03b358396c9ea28a","contentSha256":"b400ceda8fdee0e8532e890475c3853eb9649fa57e5b5cdb7b3614ab67b44c43","files":[{"path":"README.md","sha256":"66e05554c4128aef774d6a3d7e6d26a8b55fc5921c77307729f4846cad2b3ed8","size":2274},{"path":"changes/public-surface-2026-09-01.yaml","sha256":"bf707e38d05a2ff971ebf597cb8581fda36151a36ae48f82d5f46b22246a2139","size":598}]}
