{"schema":"b10x-docs-bundle/v1","repository":{"id":"llm","url":"https://github.com/beyond10x/llm"},"commit":"4af9aecb5786455d45722babeb4fd76aebab9615","producer":{"runId":36346764518},"manifestSha256":"39300f0c4efbde3b33183b971827cb942cb533ca28eed1b0f6ff0ac838317dcc","collectionSha256":"4b7cb3afa68c991a47d4ce1982e9167655475c41df4cc9145a7b40ea98fc4526","contentSha256":"d9ddaa1e6e3a1d9405fec327d52454bbbfad7ec17a95a787e1685aca94b9d8d4","files":[{"path":"changes/public-surface-2026-09-20.yaml","sha256":"8ed507c624109c4fba300e2dad13d9c3e57c0a8a524ba3263b5ced88346b3bd2","size":491},{"path":"website/docs/concepts/accounting.md","sha256":"0fee13901bd78088fb784f988a1a4d006229718c4e5910b896477c5e2045d2d9","size":4946},{"path":"website/docs/concepts/credentials.md","sha256":"6dffdbce3ae963f936b9a594e469f0be9ffbd940cdb3c36cceff0a1cf5d67170","size":3406},{"path":"website/docs/concepts/gateway.md","sha256":"d6ac8fe2da292c1f3d581341d953093b014fda72dea5dfd2f53e03285452801f","size":4312},{"path":"website/docs/concepts/hosting.md","sha256":"cac19d809de4b8cd28b0c54607177bfc64490833320084e6e5142f33a16a580d","size":6975},{"path":"website/docs/concepts/neutral-boundary.md","sha256":"0b6119ebef48bbb9d3f8af97069329fe5ae8548c5e1bccded3333a5792634e6f","size":5798},{"path":"website/docs/concepts/overview.md","sha256":"b2e7fad1bb94cba777ca3a4624d69b9edd1603a44d9170fda665473afc16ca5e","size":3664},{"path":"website/docs/concepts/protocols.md","sha256":"23e5e0fce75dbf069ad916cc704c7fb2fc1ea2e9f26e8759e85e3bd5b7e64da5","size":5386},{"path":"website/docs/concepts/routing.md","sha256":"02a483e8c7acca529b83dcc73c9e7b45d1233b1bcb4b5735f75d93fb16e2d17b","size":4988},{"path":"website/docs/getting-started.md","sha256":"0dda36550882a3e788a033d8466b1cf49339b86f0490145f103295bf4674f3b3","size":3323},{"path":"website/docs/guides/call-a-local-endpoint.md","sha256":"7032f2389518153f17f779d1051a64585473ad62b6352b1ea817f1ea3cf87ec2","size":4503},{"path":"website/docs/guides/explain-a-route.md","sha256":"d126ec5eddebe922e51e9e183af6398d12dc79da4623b234d81872faebd6372f","size":3433},{"path":"website/docs/guides/price-recorded-usage.md","sha256":"579687afdabb46914018028bef7b9339d90f8f2552abd44f09fb43e97c814ba3","size":2657},{"path":"website/docs/guides/resolve-a-local-secret.md","sha256":"4ee638e346293917cb779ad99746c5a7c653f94d02bb0fe8f5f4adfeec2c1786","size":3990},{"path":"website/docs/guides/run-a-local-turn.md","sha256":"70576a808c85bd2b09aaa0dfdc34925f740a6f2079bf2dfd29649b7dd96f8b70","size":2136},{"path":"website/docs/guides/run-the-checks.md","sha256":"77df7b088518c2a97abaf0add49509fa87bfc0aef545ed1bfc967d224e91834c","size":3314},{"path":"website/docs/guides/start-the-gateway.md","sha256":"a67503cc95cd2e40e5979676158ccd4046ae683ce317f2e529f9a8fc08afe4fe","size":4284},{"path":"website/docs/index.md","sha256":"385a2408de0c5806ef559e43922efa4a4e8369405aa895f9e532d88874925b35","size":4324},{"path":"website/docs/reference/crates.md","sha256":"6bb711bf2e0afee929a4c7f05902a8bec1d636693f4c35f370ae4da9ab8e973c","size":4018},{"path":"website/docs/reference/formats.md","sha256":"be733302a7131b962de34bb4e1b39420d3f0be6b71dd1d7a4b58305328bd5958","size":2524},{"path":"website/docs/status/limitations.md","sha256":"fd32256db72aee1fe57a833c08c4f4056f48207a5fc5cc7c46431d8ad386451e","size":4453},{"path":"website/docs/status/roadmap.md","sha256":"951b44b25f6fa74db96941315fdbd7f5547f5756c425bd08f9b78e6d6845739b","size":4157},{"path":"website/docs/status/where-this-stands.md","sha256":"2d9e49b0290cbbbd4b10f1507f0024dbfd1eb3fda069538dd5baeb9731f94dc7","size":3696},{"path":"website/static/.nojekyll","sha256":"e3b0c44298fc1c149afbf4c8996fb92427ae41e4649b934ca495991b7852b855","size":0},{"path":"website/static/img/favicon.ico","sha256":"86ed40482f3ff6b2f70e08b267a3d1bdb17cb7465463e320d7d5e24183778956","size":5430},{"path":"website/static/img/mark.svg","sha256":"5fc1afe5edc43ffc02692146c35fae22674e759a702a0fa81b2c39ed56b34881","size":1039}]}
