{"schema":"b10x-docs-bundle/v1","repository":{"id":"docs-system","url":"https://github.com/beyond10x/docs-system"},"commit":"d7c80849f74fe4eba7d4f6f73da5546cf2d1f90a","producer":{"runId":40835661591},"manifestSha256":"34f596671c6c684c38c2a67a4bf620ef89d9ac173a9f56a831b7580de0c83c6a","collectionSha256":"6c3482e046e733cf814c6334b08f34a79c08fe31a4809d6b90d15270f7d543de","contentSha256":"a6625c13c5a4772b252a8b439df20a9ac5d6edaae3fe3c8988f8555c6f3a3c9d","files":[{"path":"CHANGELOG.md","sha256":"3590a08d06d7425a01d1384c05795cfc447b167fc839700613ff7cca00a19d11","size":24098},{"path":"README.md","sha256":"515d43b75a31fbd2c60c866b39a3d39938137f3983ca2a4fb6b2a1021386cbac","size":29750},{"path":"changes/docs-system-0.2.0.yaml","sha256":"d6a4425e52f25fd1a6762184ae289e3da9e6b797cf2d472dab2fbd7fef8bd317","size":727},{"path":"changes/docs-system-0.3.0.yaml","sha256":"e0adb9bcf05e832fab73f9438ba4a532c6c055568516fcc724f8df52f750387f","size":922},{"path":"changes/docs-system-0.3.1.yaml","sha256":"f83a244b29ab771000213105b1e91b1d5371510f74e532efff3a3cacdaf476b9","size":937},{"path":"changes/docs-system-0.3.2.yaml","sha256":"b747e89124724313a3e205e58106c8dd076002dba1f84b5a6d8a68126cf663db","size":826},{"path":"changes/docs-system-0.3.3.yaml","sha256":"c83e15cd2479b61fd7da102d6ce9c96aba14f3276b74885ade7117005c27fb29","size":957},{"path":"schema/b10x.change.v2.schema.json","sha256":"dff551fb5e950daaa9edd1c6b0a88b9b332b9908a47a5180ae31764ed7f9b771","size":3266},{"path":"schema/b10x.docs.bundle.v1.schema.json","sha256":"6078559d01deca7dd32af218bea972b386f73767a89ade5da238287f2372afa4","size":2107},{"path":"schema/b10x.docs.v3.schema.json","sha256":"ad456e1b77dedbf734522e77b95a2110c0308ddf4192a29eaca84a1d489027ae","size":8865},{"path":"schema/b10x.redirects.schema.json","sha256":"2e2382a05c85e0404d264d315267386cd1c7b0eeb5065b3207e765995a1659e7","size":1429},{"path":"schema/b10x.sources.schema.json","sha256":"5ee49f6ebe8e97c850c8e2d77d9f1e3a40daacd5ef1086bde6345e63af669489","size":1144}]}
